{
  "authority": {
    "allowed_actions": [
      {
        "destination": "https://mcp.aau.invalid",
        "operation": "inventory.read",
        "protocol": "mcp",
        "resource": "staging:asset-17"
      },
      {
        "destination": "https://peer.aau.invalid",
        "operation": "message/send",
        "protocol": "a2a",
        "resource": "public:maintenance-summary"
      }
    ],
    "allowed_peers": [
      "agent:synthetic-reviewer-01"
    ],
    "delegation": {
      "allowed": true,
      "max_depth": 1,
      "operations": [
        "inventory.read"
      ]
    },
    "human_owner_ref": "role:synthetic-maintenance-owner",
    "lease_id": "lease:synthetic-maintenance:001",
    "monitoring_required": true,
    "policy_epoch": 7,
    "revocation_state": "active",
    "task_id": "task:inspect-staging-evidence:001",
    "valid_from": "2026-08-30T12:05:00Z",
    "valid_until": "2026-08-30T13:05:00Z"
  },
  "claim_boundaries": {
    "no_live_action_authorized": true,
    "not_authorization_to_operate": true,
    "not_certification": true,
    "not_compliance_finding": true,
    "not_government_endorsement": true,
    "production_identity_not_verified": true
  },
  "classification": {
    "data": "synthetic",
    "live_system": false,
    "test_credentials_only": true
  },
  "envelope_id": "assurance:synthetic-maintenance-agent:2026-08-30",
  "envelope_version": "aau-agent-assurance-envelope/0.1",
  "evidence": {
    "boundary_profile_sha256": null,
    "evaluation_receipt_sha256": null,
    "independent_reproduction": "not_provided"
  },
  "expires_at": "2026-08-31T12:00:00Z",
  "issued_at": "2026-08-30T12:00:00Z",
  "protocols": {
    "a2a": {
      "agent_card_sha256": "f83be945eb169fdab6d40ca75f4d158425492f63a591e1839a28fc760048936f",
      "authorization_per_request": true
    },
    "mcp": {
      "authorization_profile": "oauth-resource-bound-recorded-fixture",
      "token_passthrough_forbidden": true
    }
  },
  "subject": {
    "agent_id": "agent:synthetic-maintainer-01",
    "identity_verifier": {
      "algorithm": "HS256",
      "audience": "https://gateway.aau.invalid",
      "issuer": "https://identity.aau.invalid",
      "key_id": "public-fixture-key-2026-08-30",
      "mode": "synthetic_local_fixture",
      "test_only_shared_secret": "PUBLIC-SYNTHETIC-SECRET-NEVER-USE-IN-PRODUCTION-2026"
    },
    "operator_ref": "operator:synthetic-public-lab",
    "workload_identity": {
      "identifier": "spiffe://aau.invalid/agents/synthetic-maintainer-01",
      "kind": "spiffe"
    }
  },
  "telemetry": {
    "format": "opentelemetry-compatible-json",
    "include_credentials": false,
    "include_personal_data": false,
    "include_prompts": false
  }
}
